{
  "session_id": "00000000-0000-4000-8000-000000000001",
  "dataset": { "name": "iris_mock", "rows": 10, "dims": 4 },
  "bounds": { "min": [0, 4, 0], "max": [128, 60, 128] },
  "global_centroid": [64, 32, 64],
  "clusters": [
    {
      "id": 0,
      "label": "setosa-like",
      "color": "minecraft:red_concrete",
      "mean": [30, 30, 30],
      "point_ids": [0, 1, 2, 3, 4]
    },
    {
      "id": 1,
      "label": "virginica-like",
      "color": "minecraft:blue_concrete",
      "mean": [90, 40, 90],
      "point_ids": [5, 6, 7, 8, 9]
    }
  ],
  "points": [
    { "id": 0, "pos": [28, 30, 30], "cluster_id": 0, "block": "minecraft:red_concrete",  "outlier_score": 0.10 },
    { "id": 1, "pos": [32, 30, 30], "cluster_id": 0, "block": "minecraft:red_concrete",  "outlier_score": 0.12 },
    { "id": 2, "pos": [30, 31, 28], "cluster_id": 0, "block": "minecraft:red_concrete",  "outlier_score": 0.08 },
    { "id": 3, "pos": [30, 29, 32], "cluster_id": 0, "block": "minecraft:red_concrete",  "outlier_score": 0.15 },
    { "id": 4, "pos": [31, 30, 31], "cluster_id": 0, "block": "minecraft:red_concrete",  "outlier_score": 0.05 },
    { "id": 5, "pos": [88, 40, 90], "cluster_id": 1, "block": "minecraft:blue_concrete", "outlier_score": 0.11 },
    { "id": 6, "pos": [92, 40, 90], "cluster_id": 1, "block": "minecraft:blue_concrete", "outlier_score": 0.09 },
    { "id": 7, "pos": [90, 41, 88], "cluster_id": 1, "block": "minecraft:blue_concrete", "outlier_score": 0.13 },
    { "id": 8, "pos": [90, 39, 92], "cluster_id": 1, "block": "minecraft:blue_concrete", "outlier_score": 0.07 },
    { "id": 9, "pos": [91, 40, 91], "cluster_id": 1, "block": "minecraft:blue_concrete", "outlier_score": 0.06 }
  ],
  "commands": []
}
